<?xml version="1.0" encoding="utf-8"?>
<!DOCTYPE dict SYSTEM "gml.dtd">
<dict xmlns="http://www.gelaba.org/gml/1.1" name="dict-modalites-pedagogiques-formacodes-V10">
  <fullname xml:lang="fr">Modalités pédagogiques formacodes V10</fullname>
  <doc xml:lang="fr">
  </doc>
   <entry>
      <key val="96121" />
      <value xml:lang="fr" val="Modalités pédagogiques" />
    </entry>
    <entry>
      <key val="96124" />
      <value xml:lang="fr" val="Autoformation" />
    </entry>
    <entry>
      <key val="96125" />
      <value xml:lang="fr" val="Autoformation avec tutorat" />
    </entry>
    <entry>
      <key val="96126" />
      <value xml:lang="fr" val="Autoformation sans tutorat" />
    </entry>
    <entry>
      <key val="96127" />
      <value xml:lang="fr" val="Chantier école" />
    </entry>
    <entry>
      <key val="96142" />
      <value xml:lang="fr" val="En alternance" />
    </entry>
    <entry>
      <key val="96129" />
      <value xml:lang="fr" val="FOAD" />
    </entry>
    <entry>
      <key val="96133" />
      <value xml:lang="fr" val="FOAD avec tutorat asynchrone" />
    </entry>
    <entry>
      <key val="96130" />
      <value xml:lang="fr" val="FOAD avec tutorat synchrone" />
    </entry>
    <entry>
      <key val="96131" />
      <value xml:lang="fr" val="FOAD sans tutorat" />
    </entry>
    <entry>
      <key val="96128" />
      <value xml:lang="fr" val="Formation à distance" />
    </entry>
    <entry>
      <key val="96134" />
      <value xml:lang="fr" val="Formation action" />
    </entry>
    <entry>
      <key val="96147" />
      <value xml:lang="fr" val="Formation en situation de travail" />
    </entry>
    <entry>
      <key val="96132" />
      <value xml:lang="fr" val="Pédagogie adaptée aux handicapés" />
    </entry>
    <entry>
      <key val="96149" />
      <value xml:lang="fr" val="Séjour à l'étranger" />
    </entry>
    <entry>
      <key val="96410" />
      <value xml:lang="fr" val="Périodes de formation" />
    </entry>
    <entry>
      <key val="96414" />
      <value xml:lang="fr" val="Cours de jour" />
    </entry>
    <entry>
      <key val="96411" />
      <value xml:lang="fr" val="Cours du soir" />
    </entry>
    <entry>
      <key val="96412" />
      <value xml:lang="fr" val="Cours le week end" />
    </entry>
    <entry>
      <key val="96413" />
      <value xml:lang="fr" val="Hors temps de travail" />
    </entry>

  <property name="version" value="V10" />
  <property name="url" value="" />
</dict>
