<?xml version="1.0" encoding="utf-8"?>
<!DOCTYPE dict SYSTEM "gml.dtd">
<dict xmlns="http://www.gelaba.org/gml/1.1" name="dict-etat-recrutement">
  <fullname xml:lang="fr">Etat du recrutement</fullname>
  <doc xml:lang="fr">
  </doc>
    <entry>
      <key val="1"/>
      <value xml:lang="fr" val="ouvert"/>
    </entry>
    <entry>
      <key val="2"/>
      <value xml:lang="fr" val="fermÃ©"/>
    </entry>
    <entry>
      <key val="3"/>
      <value xml:lang="fr" val="suspendu"/>
    </entry>
  <property name="version" value="V1" />
  <property name="url" value="" />
</dict>
