<?xml version="1.0" encoding="utf-8"?>
<!DOCTYPE dict SYSTEM "gml.dtd">
<dict xmlns="http://www.gelaba.org/gml/1.1" name="dict-niveaux">
  <fullname xml:lang="fr">Niveaux</fullname>
  <doc xml:lang="fr">
  </doc>
    <entry>
      <key val="0" />
      <value xml:lang="fr" val="information non communiquée" />
    </entry>
    <entry>
      <key val="1" />
      <value xml:lang="fr" val="sans niveau spécifique" />
    </entry>
    <entry>
      <key val="2" />
      <value xml:lang="fr" val="niveau VI (illettrisme, analphabétisme)" />
    </entry>
    <entry>
      <key val="3" />
      <value xml:lang="fr" val="niveau V bis (préqualification)" />
    </entry>
    <entry>
      <key val="4" />
      <value xml:lang="fr" val="niveau V (CAP, BEP, CFPA du premier degré)" />
    </entry>
    <entry>
      <key val="5" />
      <value xml:lang="fr" val="niveau IV (BP, BT, baccalauréat professionnel ou technologique)" />
    </entry>
    <entry>
      <key val="6" />
      <value xml:lang="fr" val="niveau III (BTS, DUT)" />
    </entry>
    <entry>
      <key val="7" />
      <value xml:lang="fr" val="niveau II (licence ou maîtrise universitaire)" />
    </entry>
    <entry>
      <key val="8" />
      <value xml:lang="fr" val="niveau I (supérieur à la maîtrise)" />
    </entry>
  <property name="version" value="V1" />
  <property name="url" value="" />
</dict>
